{
  "protocol": "ArtifactRegistry/v1",
  "artifactSetId": "artifact-set:synthetic-area-intelligence-v1",
  "sourceScope": {
    "sourceId": "synthetic-area-intelligence",
    "scopeId": "fixture-contract-v1",
    "revision": "synthetic-revision-20260820",
    "dataClassification": "synthetic-test"
  },
  "clocks": {
    "sourceAsOf": "2026-08-20T00:00:00.000Z",
    "retrievedAt": "2026-08-21T00:00:00.000Z",
    "builtAt": "2026-08-22T00:00:00.000Z",
    "observedAt": "2026-08-23T00:00:00.000Z"
  },
  "versions": {
    "producer": {
      "name": "synthetic-fixture-producer",
      "version": "1.0.0"
    },
    "schema": {
      "name": "synthetic-row-schema",
      "version": "1.0.0"
    },
    "transform": {
      "name": "synthetic-partitioner",
      "version": "1.0.0"
    }
  },
  "locations": [
    {
      "scheme": "https",
      "baseUrl": "https://artifacts.example.invalid/immutable/synthetic-area-intelligence-v1/"
    }
  ],
  "objects": [
    {
      "objectId": "manifest",
      "relativePath": "metadata/manifest.json",
      "mediaType": "application/json",
      "bytes": 128,
      "sha256": "sha256:1111111111111111111111111111111111111111111111111111111111111111",
      "rowCount": null
    },
    {
      "objectId": "part-000",
      "relativePath": "parts/part-000.jsonl",
      "mediaType": "application/x-ndjson",
      "bytes": 256,
      "sha256": "sha256:2222222222222222222222222222222222222222222222222222222222222222",
      "rowCount": 2
    },
    {
      "objectId": "part-001",
      "relativePath": "parts/part-001.jsonl",
      "mediaType": "application/x-ndjson",
      "bytes": 384,
      "sha256": "sha256:3333333333333333333333333333333333333333333333333333333333333333",
      "rowCount": 3
    }
  ],
  "partitionInventory": {
    "partitions": [
      {
        "partitionId": "partition-000",
        "objectIds": ["part-000"],
        "rowCount": 2
      },
      {
        "partitionId": "partition-001",
        "objectIds": ["part-001"],
        "rowCount": 3
      }
    ],
    "unpartitionedObjectIds": ["manifest"],
    "totalObjectCount": 3,
    "totalBytes": 768,
    "totalRowCount": 5
  },
  "retention": {
    "state": "retained",
    "decisionOwner": "synthetic-fixture-owner",
    "deletePrerequisites": [
      "artifact-integrity-rechecked",
      "downstream-dependencies-cleared",
      "explicit-owner-decision-recorded",
      "retention-period-satisfied"
    ]
  },
  "authority": {
    "serving": false,
    "promotion": false,
    "deletion": false
  },
  "registryIdentity": "sha256:fb797f3ba88d61c38ae14539eb5d0143279af8885f0ef1a8927c59132b8a032b"
}
